<?xml version="1.0" encoding="UTF-8"?>
<!--<!DOCTYPE beatles SYSTEM "Ej3.dtd"> -->

<beatles xmlns:xsi="http://www.w3.org/2001/XMLSchema-instance" xsi:noNamespaceSchemaLocation="Ej3.xsd">
    <beatle link="http://www.paulmccartney.com">
        <name>
            <firstname>Paul</firstname>
            <lastname>McCartney</lastname>
        </name>
    </beatle>
    <beatle link="http://www.johnlennon.com">
        <name>
            <firstname>John</firstname>
            <lastname>Lennon</lastname>
        </name>
    </beatle>
    <beatle link="http://www.georgeharrison.com">
        <name>
            <firstname>George</firstname>
            <lastname>Harrison</lastname>
        </name>
    </beatle>
    <beatle link="http://www.ringostarr.com">
        <name>
            <firstname>Ringo</firstname>
            <lastname>Starr</lastname>
        </name>
    </beatle>
    <beatle link="http://www.webucator.com" real="no">
        <name>
            <firstname>Nat</firstname>
            <lastname>Dunn</lastname>
        </name>
    </beatle>
</beatles>